"No.","Date","Genre","Bibl","URL","ContextBefore","Hit","ContextAfter"
"756","2020-03-30","internetbasiert","Corona auf Flüchtlingsinseln ""nur noch eine Frage der Zeit"". https://www.merkur.de, 2020-03-30","https://www.merkur.de/politik/unhcr-wegen-corona-fluechtlingslager-auf-inseln-evakuieren-zr-13633160.html","Im Rahmen der Maßnahmen , die der griechische Staat vor zwei Wochen gegen das Coronavirus getroffen hat , dürfen neben den Bürgern nun auch die Lagerbewohner nur noch in Ausnahmefällen ihr ""","Zuhause",""" verlassen - und dann nur 100 Menschen pro Stunde ."
"757","2020-03-30","internetbasiert","Coronavirus News am Montag - die wichtigsten Entwicklungen zu Covid-19 und Sars-CoV-2 - DER SPIEGEL - Wissenschaft. Derspiegel, 2020-03-30","https://www.spiegel.de/wissenschaft/medizin/coronavirus-news-am-montag-die-wichtigsten-entwicklungen-zu-covid-19-und-sars-cov-2-a-861d1bf7-3550-4e97-9911-928e87782ea8","Bei dem einstündigen Zusammenschnitt traten die Musiker in ihrem","Zuhause","auf und spielten ihre Hits ."
"758","2020-03-30","internetbasiert","Wenn Angehörige zur Coronavirus-Risikogruppe zählen - so verhalten Sie sich richtig. https://www.merkur.de, 2020-03-30","https://www.merkur.de/leben/gesundheit/coronavirus-wenn-angehoerige-risikogruppe-zaehlen-verhalten-sich-zr-13616351.html","So minimieren Sie das Risiko , sich selbst und somit Ihre Angehörigen mit Covid-19 anzustecken .Viele Unternehmen gewähren ihren Mitarbeitern aktuell die Möglichkeit , von","Zuhause","aus zu arbeiten ."
"759","2020-03-30","internetbasiert","Steuertipp für Heimarbeit: Das Homeoffice ist absetzbar. Frankfurter Allgemeine Zeitung, 2020-03-30","https://www.faz.net/1.6703645","„ Arbeitnehmer müssen dafür allerdings nachweisen , dass ihr Arbeitgeber das Arbeiten von","Zuhause","aus angeordnet hat “ , sagte der Steuerrechtsexperte Matthias Hiller von der SRH Fernhochschule der Deutschen Presse-Agentur ."
"760","2020-03-30","internetbasiert","Corona-Krise: Wie Obdachlosen am Bahnhof Zoo jetzt geholfen wird - DER SPIEGEL - Panorama. Derspiegel, 2020-03-30","https://www.spiegel.de/panorama/corona-krise-wie-obdachlosen-am-bahnhof-zoo-jetzt-geholfen-wird-a-ad5b119d-0ef8-49bd-b866-32e3e45cff3a","Aber während sich viele","Zuhause","einrichten können , bleiben Menschen ohne Obdach auf der Straße ."
"761","2020-03-30","internetbasiert","Corona-Crash? Pandemie beeinträchtigt auch Bayern. nordbayern.de, 2020-03-30","https://www.nordbayern.de/sport/corona-crash-pandemie-beeintrachtigt-auch-bayern-1.9990638","","Zuhause","setzte der Club bereits einige Ausrufzeichen gegen den Rivalen aus der ungeliebten Landeshauptstadt - zuletzt in der Winter-Vorbereitung auf die nun unterbrochene Rückrunde ."
"762","2020-03-30","internetbasiert","Corona-Crash? Pandemie beeinträchtigt auch Bayern. nordbayern.de, 2020-03-30","https://www.nordbayern.de/sport/corona-crash-pandemie-beeintrachtigt-auch-bayern-1.9990638","Wie viele Millionen andere Deutsche arbeitet auch unsere Redaktion nun von","Zuhause","."
"763","2020-03-30","internetbasiert","+++ 23:50 Warnung vor Nebenwirkungen experimenteller Corona-Therapien +++. N-Tv Nachrichten, 2020-03-30","https://www.n-tv.de/panorama/23-50-Warnung-vor-Nebenwirkungen-experimenteller-Corona-Therapien--article21680837.html","Deshalb müssten alle","Zuhause","ihre Gesundheit strikt überwachen ."
"764","2020-03-30","internetbasiert","Havas Media Corona Monitor: TV profitiert von Corona-Krise am stärksten. https://www.horizont.net, 2020-03-30","https://www.horizont.net/medien/nachrichten/havas-media-corona-monitor-tv-profitiert-von-corona-krise-am-staerksten-181965","Da überrascht es nicht , dass auch laut Havas Media Corona Monitor immer mehr Menschen von","Zuhause","aus arbeiten :"
"765","2020-03-29","internetbasiert","+++Coronavirus-Update+++ - Coronavirus: Fast 15'000 Infizierte und 300 Todesfälle in der Schweiz - Taskforce-Virologe rechnet mit Millionen von Fällen in den USA. Cash, 2020-03-29","https://www.cash.ch/news/politik/coronavirus-update-coronavirus-fast-15000-infizierte-und-300-todesfaelle-der-schweiz-taskforce-1512942","Sie sollen ein sicheres","Zuhause","haben . """
"766","2020-03-29","internetbasiert","Trump: Erwägen ""Quarantäne"" für New York. https://www.merkur.de, 2020-03-29","https://www.merkur.de/politik/trump-als-kriegspraesident-im-kampf-gegen-coronavirus-zr-1-zr-13631934.html","Alle Bürger sind aufgerufen ,","Zuhause","zu bleiben , "" nicht lebenswichtige "" Einrichtungen und Firmen sind geschlossen ."
"767","2020-03-29","internetbasiert","Grüne fordern mehr Opferschutz in der Corona-Krise - WELT. DIE WELT, 2020-03-29","https://www.welt.de/regionales/nrw/article206872719/Gruene-fordern-mehr-Opferschutz-in-der-Corona-Krise.html","Für viele Menschen ohne","Zuhause","blieben zudem Duschen , Suppenküchen und Schlafplätze geschlossen ."
"768","2020-03-29","internetbasiert","Coronakrise - Breite Kritik an Adidas & Co. für Stopp von Mietzahlungen. Cash, 2020-03-29","https://www.cash.ch/news/politik/coronakrise-breite-kritik-adidas-co-fuer-stopp-von-mietzahlungen-1513076","Mit dem Notfallgesetz will die Politik verhindern , dass Wohnungsmieter ihr","Zuhause","verlieren und Ladenmieter ihre berufliche Existenz ."
"769","2020-03-29","internetbasiert","Frankfurter Gastronomen in Coronakrise: „Man muss zwangsläufig unternehmerisch kreativ sein“. https://www.fr.de, 2020-03-29","https://www.fr.de/frankfurt/coronavirus-sti164091/frankfurt-corona-gastronomen-restaurants-lieferservice-kreativ-13631369.html","Zusammen mit der Digitalagentur Ena Office entwickelten sie in den vergangenen Wochen ein neues Geschäftsmodell : „ Margarete","Zuhause","“ ."
"770","2020-03-29","internetbasiert","Frankfurter Gastronomen in Coronakrise: „Man muss zwangsläufig unternehmerisch kreativ sein“. https://www.fr.de, 2020-03-29","https://www.fr.de/frankfurt/coronavirus-sti164091/frankfurt-corona-gastronomen-restaurants-lieferservice-kreativ-13631369.html","Margarete","Zuhause",", Braubachstraße 18 ."
"771","2020-03-29","internetbasiert","Coronakrise in USA: Über 2200 Tote. Apotheken Umschau, 2020-03-29","https://www.apotheken-umschau.de/Coronavirus/Coronakrise-in-USA-Ueber-2200-Tote-557757.html","Alle Bürger sind aufgerufen ,","Zuhause","zu bleiben ."
"772","2020-03-29","internetbasiert","Corona und Airbnb: Könnten nun Mieter profitieren?. Neue Zürcher Zeitung, 2020-03-29","https://www.nzz.ch/wirtschaft/corona-laesst-airbnb-einbrechen-koennten-mieter-profitieren-ld.1548138","Auf solche Ideen kämen in der Krise einige , sagt Andreas Loepfe , Spezialist für Immobilienwirtschaft an der Uni Zürich : « Hotels und Ferienwohnungsvermieter werden sich lokal ausrichten , an Leute vermieten , denen in diesen Zeiten ihr","Zuhause","zu eng wird » , sagt er am Telefon ."
"773","2020-03-29","internetbasiert","Grönland führt wegen Corona-Krise Alkoholverbot für Hauptstadt ein. Cash, 2020-03-29","https://www.cash.ch/news/groenland-fuehrt-wegen-corona-krise-alkoholverbot-fuer-hauptstadt-ein-1513080","Sie sollen ein sicheres","Zuhause","haben . """
"774","2020-03-29","internetbasiert","Wie Sie sich die freie Zeit zu Hause vertreiben können. Tagesspiegel, 2020-03-29","https://www.tagesspiegel.de/berlin/tipps-fuer-die-coronavirus-krise-wie-sie-sich-die-freie-zeit-zu-hause-vertreiben-koennen/25685938.html","Jedes Ding braucht sein","Zuhause","."
"775","2020-03-29","internetbasiert","Adidas stoppt Mietzahlungen: „Dafür habe ich kein Verständnis“. Frankfurter Allgemeine Zeitung, 2020-03-29","https://www.faz.net/1.6702419","Mit dem Notfallgesetz will die Politik verhindern , dass Wohnungsmieter ihr","Zuhause","verlieren und Ladenmieter ihre berufliche Existenz ."
"776","2020-03-29","internetbasiert","Das etwas andere Logbuch - Das Leben in den Zeiten der Corona, Woche 2. freitag.de, 2020-03-29","https://www.freitag.de/autoren/cabee/das-leben-in-den-zeiten-der-corona-woche-2-1","","Zuhause","stellte ich fest : falscher Alarm ."
"777","2020-03-29","internetbasiert","Das etwas andere Logbuch - Das Leben in den Zeiten der Corona, Woche 2. freitag.de, 2020-03-29","https://www.freitag.de/autoren/cabee/das-leben-in-den-zeiten-der-corona-woche-2-1","","Zuhause","steige ich ins Auto , eigentlich wollte ich es für Stadtfahrten nicht mehr benutzen ."
"778","2020-03-29","internetbasiert","Coronavirus: Au-Pair in Neuseeland vorzeitig beendet. Panorama, 2020-03-29","https://www.zdf.de/uri/0422d700-1da2-4c20-b57d-4fa8911d61d0","Jeder wurde aufgefordert , die nächsten vier Wochen","Zuhause","zu bleiben , um die weitere Ausbreitung des Virus zu verlangsamen ."
"779","2020-03-29","internetbasiert","Newsticker zur Coronavirus Krise: Alles Wichtige am Sonntag im Überblick - manager magazin. Manager Magazin, 2020-03-29","https://www.manager-magazin.de/unternehmen/artikel/newsticker-zur-coronavirus-krise-alles-wichtige-am-sonntag-im-ueberblick-a-1305807.html","Alle Bürger sind aufgerufen ,","Zuhause","zu bleiben , "" nicht lebenswichtige "" Einrichtungen und Firmen sind geschlossen ."
"780","2020-03-29","internetbasiert","Trump riegelt Corona-Hotspots nicht ab - mehr als 2400 Tote - WELT. DIE WELT, 2020-03-29","https://www.welt.de/newsticker/dpa_nt/afxline/topthemen/article206871417/Trump-riegelt-Corona-Hotspots-nicht-ab-mehr-als-2400-Tote.html","Alle Bürger sind aufgerufen ,","Zuhause","zu bleiben ."
"781","2020-03-29","internetbasiert","Trump: Keine Quarantäne für Coronavirus-Hotspots in den USA. Politik, 2020-03-29","https://www.zdf.de/uri/73f28d0b-e6be-4069-9b41-889b39d2ce6e","Alle Bürger sind aufgerufen ,","Zuhause","zu bleiben ."
"782","2020-03-28","internetbasiert","Corona-Krise: Spanien verschärft Ausgangsbeschränkungen weiter. Cash, 2020-03-28","https://www.cash.ch/news/corona-krise-spanien-verschaerft-ausgangsbeschraenkungen-weiter-1512874","Jedoch war die Bevölkerung aufgefordert , so viel wie möglich von","Zuhause","aus zu arbeiten ."
"783","2020-03-28","internetbasiert","Vizegouverneur von Texas über Coronakrise: Wo Alte sterben sollen. Tazgezwitscher, 2020-03-28","https://taz.de/!5671164/","Und dann müssen die Risikogruppen weiter","Zuhause","bleiben und solidarisch mitversorgt werden ."
"784","2020-03-28","internetbasiert","Mieten-Demo in Berlin trotz Corona: „Lärmkonzert um 18 Uhr“. Tazgezwitscher, 2020-03-28","https://taz.de/!5671034/","Diese Gruppen können nicht einfach zuhause bleiben , weil sie kein richtiges","Zuhause","haben ."
"785","2020-03-28","internetbasiert","«Earth Hour»: Zeichen für den Klimaschutz trotz Corona - WELT. DIE WELT, 2020-03-28","https://www.welt.de/regionales/sachsen/article206857323/Earth-Hour-Zeichen-fuer-den-Klimaschutz-trotz-Corona.html","Wegen des Versammlungsverbots sind die Menschen dazu aufgerufen , von","Zuhause","Selfies aus der Dunkelheit online zu teilen ."
"786","2020-03-28","internetbasiert","„Ältere und Kranke werden ihre Kontakte deutlich länger reduzieren müssen“. Tagesspiegel, 2020-03-28","https://www.tagesspiegel.de/politik/kanzleramtschef-erteilt-rascher-lockerung-eine-absage-aeltere-und-kranke-werden-ihre-kontakte-deutlich-laenger-reduzieren-muessen/25690036.html","Man hört aber auch , es gebe Netzprobleme , wenn so viele gleichzeitig von","Zuhause","arbeiten , Telekonferenz machen und Videos streamen ."
"787","2020-03-28","internetbasiert","Mietkonflikt - Zahlreiche Firmen zahlen in Corona-Krise keine Shop-Mieten mehr. Cash, 2020-03-28","https://www.cash.ch/news/politik/mietkonflikt-zahlreiche-firmen-zahlen-corona-krise-keine-shop-mieten-mehr-1512374","Mit dem Notfallgesetz will die Politik verhindern , dass Wohnungsmieter ihr","Zuhause","verlieren und Ladenmieter ihre berufliche Existenz ."
"788","2020-03-28","internetbasiert","+++Coronavirus-Update+++ - Coronavirus: Trump erwägt Isolation von New York - NHS-Chef: «Weniger als 20'000 Tote wären ein gutes Ergebnis». Cash, 2020-03-28","https://www.cash.ch/news/politik/coronavirus-update-coronavirus-trump-erwaegt-isolation-von-new-york-nhs-chef-weniger-als-20000-tote-1512688","Jedoch war die Bevölkerung aufgefordert , so viel wie möglich von","Zuhause","aus zu arbeiten ."
"789","2020-03-28","internetbasiert","News-Update zur Coronakrise: Auch Spanien ruft Militär zum Transport der Leichen - DER SPIEGEL - Wissenschaft. Derspiegel, 2020-03-28","https://www.spiegel.de/wissenschaft/medizin/coronavirus-news-am-samstag-die-wichtigsten-entwicklungen-zu-sars-cov-2-und-covid-19-a-b20dfd7b-f859-4933-b1fe-7f96f16f3bfc","Jedoch war die Bevölkerung aufgefordert , so viel wie möglich von","Zuhause","aus zu arbeiten ."
"790","2020-03-28","internetbasiert","Mieten-Demo in Berlin trotz Corona: „Lärmkonzert um 18 Uhr“. Tazgezwitscher, 2020-03-28","https://taz.de/!5671034/","Diese Gruppen können nicht einfach zuhause bleiben , weil sie kein richtiges","Zuhause","haben ."
"791","2020-03-28","internetbasiert","Vizegouverneur von Texas über Coronakrise: Wo Alte sterben sollen. Tazgezwitscher, 2020-03-28","https://taz.de/!5671164/","Und dann müssen die Risikogruppen weiter","Zuhause","bleiben und solidarisch mitversorgt werden ."
"792","2020-03-28","internetbasiert","Spanien verschärft Ausgangssperre im Kampf gegen Corona. Wirtschaft, 2020-03-28","https://www.zdf.de/uri/88779ee1-37ae-4952-8eba-f09f953291d9","Jedoch war die Bevölkerung aufgefordert , so viel wie möglich von","Zuhause","aus zu arbeiten ."
"793","2020-03-28","internetbasiert","„Wir haben gekämpft, mitgenommen zu werden“: Jähes Ende für Birgitt Binders Marokko-Urlaub. https://www.merkur.de, 2020-03-28","https://www.merkur.de/lokales/erding/dorfen-ort28598/heimreise-wegen-corona-wir-haben-gekaempft-mitgenommen-zu-werden-jaehes-ende-fuer-birgit-binders-marokko-urlaub-13628680.html","Und wir hatten ja , im Gegensatz zu den Flüchtlingen , zu jeder Zeit ein festes Ziel : unser","Zuhause",". “"
"794","2020-03-28","internetbasiert","Hofberichterstattung trifft Service-Journalismus. Tichys Einblick, 2020-03-28","http://www.tichyseinblick.de/feuilleton/medien/hofberichterstattung-trifft-service-journalismus/","Die Deutschen wollen – so hat der Sender herausgefunden – weder weniger Lockdown noch mehr und finden , dass die Kanzlerin von ihrem schlecht verkabelten","Zuhause","aus eine ausgezeichnete Politik fahre ."
"795","2020-03-27","internetbasiert","EZB-Chefin - Coronavirus: Christine Lagarde ging temporär in Selbstisolation. Cash, 2020-03-27","https://www.cash.ch/news/politik/ezb-chefin-coronavirus-christine-lagarde-ging-temporaer-selbstisolation-1512036","Bundeskanzlerin Angela Merkel ist wegen des Kontakts mit einem als Corona-positiv getesteten Arzt seit letzter Woche in Quarantäne und bleibt trotz zwei negativer Tests weiter vorsorglich","Zuhause","."
"796","2020-03-27","internetbasiert","„Gab keinen Grund, länger zu warten“: Vorsitzender erklärt Vorgehen des Katastrophenstabs. https://www.merkur.de, 2020-03-27","https://www.merkur.de/lokales/freising/freising-ort28692/freising-coronavirus-minister-florian-herrmann-katastrophenstab-interview-13630129.html","Ich bin derzeit ausschließlich","Zuhause","oder in der Staatskanzlei – und dort mit dem notwendigen Abstand ."
"797","2020-03-27","internetbasiert","H&M, Adidas und Deichmann wollen keine Miete mehr zahlen - DER SPIEGEL - Wirtschaft. Derspiegel, 2020-03-27","https://www.spiegel.de/wirtschaft/unternehmen/corona-krise-h-and-m-adidas-und-deichmann-wollen-keine-miete-mehr-zahlen-a-427b3103-7b71-4dba-a4af-c7628a7a0421","Mit dem Notfallgesetz will die Politik verhindern , dass Wohnungsmieter ihr","Zuhause","verlieren und Ladenmieter ihre berufliche Existenz ."
"798","2020-03-27","internetbasiert","Corona in Syrien und Libanon: „Ausbreitung von Covid-19 in Flüchtlingslagern wäre ein Todesurteil“. https://www.fr.de, 2020-03-27","https://www.fr.de/politik/corona-syrien-libanon-ausbreitung-coronavirus-fluechtlingslagern-waere-todesurteil-13611923.html","Man kann nicht zuhause bleiben , wenn man kein","Zuhause","hat ."
"799","2020-03-27","internetbasiert","""Zu früh"": Merkel warnt vor Lockerung der Corona-Maßnahmen. nordbayern.de, 2020-03-27","https://www.nordbayern.de/politik/zu-fruh-merkel-warnt-vor-lockerung-der-corona-massnahmen-1.9980567","Wie viele Millionen andere Deutsche arbeitet auch unsere Redaktion nun von","Zuhause","."
"800","2020-03-27","internetbasiert","Wenn das Coronavirus deine Weltreise stoppt - DER SPIEGEL - Reise. Derspiegel, 2020-03-27","https://www.spiegel.de/reise/fernweh/coronavirus-was-weltreisende-jetzt-erleben-a-b35da977-73b2-432d-b4c6-33bfd134f4c6","Unser Schiff ist unser","Zuhause",", und Flüge gibt es ja auch kaum mehr zurück nach Deutschland ."
"801","2020-03-27","internetbasiert","Psychische Gesundheit und psychische Widerstandsfähigkeit während der COVID-19-Pandemie. Weltgesundheitsorganisation, 2020-03-27","https://www.euro.who.int/de/health-topics/health-emergencies/coronavirus-covid-19/news/news/2020/3/mental-health-and-psychological-resilience-during-the-covid-19-pandemic","Durch das Gebot zu Hause zu bleiben , sind einige Kinder möglicherweise einer erhöhten Gefahr bzw. vermehrt Situationen ausgesetzt , in denen der Kinderschutz gefährdet ist , oder sie werden Zeugen zwischenmenschlicher Gewalt , falls ihr","Zuhause","nicht sicher ist ."
"802","2020-03-27","internetbasiert","Coronavirus News am Freitag - die wichtigsten Entwicklungen zu Sars-CoV-2 und Covid-19 - DER SPIEGEL - Wissenschaft. Derspiegel, 2020-03-27","https://www.spiegel.de/wissenschaft/medizin/coronavirus-news-am-freitag-die-wichtigsten-entwicklungen-zu-sars-cov-2-und-covid-19-a-477a3d2c-7335-472a-8aeb-392c0bf9dc9e","Todesfälle im eigenen","Zuhause","oder in Alters- und Pflegeeinrichtungen werden bisher in Frankreich nicht erfasst ."
"803","2020-03-27","internetbasiert","„Gab keinen Grund, länger zu warten“: Vorsitzender erklärt Vorgehen des Katastrophenstabs. Merkur.de, 2020-03-27","https://www.merkur.de/lokales/freising/freising-ort28692/freising-coronavirus-minister-florian-herrmann-katastrophenstab-interview-13630129.html","Ich bin derzeit ausschließlich","Zuhause","oder in der Staatskanzlei – und dort mit dem notwendigen Abstand ."
"804","2020-03-27","internetbasiert","Nachbarschaftsheim bittet Berliner, Mundschutzmasken zu nähen. Tagesspiegel, 2020-03-27","https://www.tagesspiegel.de/berlin/mangelware-in-der-coronavirus-krise-nachbarschaftsheim-bittet-berliner-mundschutzmasken-zu-naehen/25685302.html","Noch weniger Pflegekräfte des ambulanten Pflegedienstes als gewöhnlich versorgen täglich Patientinnen und Patienten in ihrem","Zuhause","."
"805","2020-03-27","internetbasiert","Nach Corona-Test: Riesiges Graffiti von Merkel aufgetaucht - Genesungswünsche von ganz besonderer Stelle. https://www.merkur.de, 2020-03-27","https://www.merkur.de/politik/merkel-nach-corona-test-syrer-malen-riesiges-graffiti-idlib-ihr-wohlergehen-freute-uns-zr-13609615.html","Merkel habe telefonisch zugeschaltet die Kabinettssitzung geleitet * und mache ihre Arbeit vorläufig von","Zuhause","aus ."
"806","2020-03-27","internetbasiert","Coronavirus: Wo könnten immune Menschen am besten helfen? - DER SPIEGEL - Panorama. Derspiegel, 2020-03-27","https://www.spiegel.de/panorama/coronavirus-wo-koennten-immune-menschen-am-besten-helfen-a-dfdff835-1e05-425a-a668-a2a6faea8c9c","Außerdem könnte Hilfe in der Betreuung von pflegebedürftigen Menschen im eigenen","Zuhause","bald dringend gebraucht werden ."
"807","2020-03-27","internetbasiert","Katastrophenfall wegen Corona: Das ändert sich in Bayern. nordbayern.de, 2020-03-27","https://www.nordbayern.de/politik/katastrophenfall-wegen-corona-das-andert-sich-in-bayern-1.9942266","Wie viele Millionen andere Deutsche arbeitet auch unsere Redaktion nun von","Zuhause","."
"808","2020-03-27","internetbasiert","Die Ignoranten und die Hilflosen. IPG Journal, 2020-03-27","https://www.ipg-journal.de/regionen/global/artikel/detail/die-ignoranten-und-die-hilflosen-4197/","Sie konnten sich einmalig entscheiden , ihr","Zuhause","und ihre Familien für zwei Monate am Stück zu verlassen , um in Israel zu arbeiten ."
"809","2020-03-27","internetbasiert","Coronavirus-Krise: Thüringer Kommunen laufen auf Sparflamme - WELT. DIE WELT, 2020-03-27","https://www.welt.de/regionales/thueringen/article206831543/Coronavirus-Krise-Thueringer-Kommunen-laufen-auf-Sparflamme.html","In Erfurt werde die Möglichkeit , von","Zuhause","aus zu arbeiten , « großzügig ausgelegt und genutzt » , sagte Dobenecker ."
"810","2020-03-26","internetbasiert","So kommen wir gemeinsam durch die Corona-Krise. RiffReporter, 2020-03-26","https://www.riffreporter.de/corona-virus/energieperspektiven/becker_loesungen_corona/","Andere , wie Studenten , sind zum","Zuhause","bleiben verdammt ."
"811","2020-03-26","internetbasiert","Coronakrise in Österreich: Solidarisch vereinzelt. Tazgezwitscher, 2020-03-26","https://taz.de/!5670810/","Das","Zuhause","ist nicht heimelig , es bietet Schutz vorm Unheimlichen ."
"812","2020-03-26","internetbasiert","Venezia (in Zeiten des Coronavirus 16). ortheil-blog.de, 2020-03-26","http://www.ortheil-blog.de/2020/03/26/venezia-in-zeiten-des-coronavirus-16/","","Zuhause","bleiben – ja , ist in Ordnung , aber das ewige Zuhause sollte sich weiten . ( „ Normalerweise “ wäre ich jetzt in Venedig unterwegs . )"
"813","2020-03-26","internetbasiert","Venezia (in Zeiten des Coronavirus 16). ortheil-blog.de, 2020-03-26","http://www.ortheil-blog.de/2020/03/26/venezia-in-zeiten-des-coronavirus-16/","Zuhause bleiben – ja , ist in Ordnung , aber das ewige","Zuhause","sollte sich weiten . ( „ Normalerweise “ wäre ich jetzt in Venedig unterwegs . )"
"814","2020-03-26","internetbasiert","Corona-Polizei in Berlin: Vorsätzlich herumlungern verboten. Tazgezwitscher, 2020-03-26","https://taz.de/!5670869/","Aber eine richtige Lösung dafür , dass einige Menschen eben nicht nach Hause können , weil sie kein","Zuhause","haben , gibt es nicht ."
"815","2020-03-26","internetbasiert","Corona-Krise: Udo Lindenberg verlässt Hotel Atlantic. N-Tv Nachrichten, 2020-03-26","https://www.n-tv.de/der_tag/Corona-Krise-Udo-Lindenberg-verlaesst-Hotel-Atlantic-article21669960.html","Wie die ""Bild""-Zeitung berichtet , ist der 73-Jährige aus dem HamburgerHotel Atlantic , das seit 26 Jahren sein","Zuhause","ist , ausgezogen ."
"816","2020-03-26","internetbasiert","Enge Freunde. Süddeutsche Zeitung, 2020-03-26","https://www.sueddeutsche.de/panorama/coronavirus-solidaritaet-1.4857551","Man kann sich dieser Tage auch im eigenen","Zuhause","wie ein Gestrandeter auf einer einsamen Insel fühlen , aber das erscheint immer noch besser , als unterwegs irgendwo steckenzubleiben und einfach nicht weiterzukommen ."
"817","2020-03-26","internetbasiert","Corona-Polizei in Berlin: Vorsätzlich herumlungern verboten. Tazgezwitscher, 2020-03-26","https://taz.de/!5670869/","Aber eine richtige Lösung dafür , dass einige Menschen eben nicht nach Hause können , weil sie kein","Zuhause","haben , gibt es nicht ."
"818","2020-03-26","internetbasiert","Berliner Kultur im Corona-Exil: Kultur ist die beste Impfung. Tazgezwitscher, 2020-03-26","https://taz.de/!5674392/","Etwa als sich moralisch überlegen fühlende Allzweckwaffe , die besonders jene von den Dächern schreien , die sich ausruhen auf ihrer Überidentifikation mit der „ Krise “ , indem sie in ihren gemütlichen Altbauwohnungen brav Gehorsam praktizieren , und alle diffamieren , die vielleicht Angst haben vor ihrem","Zuhause",", denen es dort zu eng ist oder die nicht mal eines haben ."
"819","2020-03-26","internetbasiert","Home Office in Zeiten von Corona: Das kann man so machen. Aber dann wird’s halt Mist.. Horizont, 2020-03-26","https://www.horizont.net/marketing/talkingheads/home-office-in-zeiten-von-corona-das-kann-man-so-machen.-aber-dann-wirds-halt-mist.-181785","„","Zuhause","sind die Leute nur abgelenkt . “"
"820","2020-03-26","internetbasiert","Berliner Kultur im Corona-Exil: Kultur ist die beste Impfung. Tazgezwitscher, 2020-03-26","https://taz.de/!5674392/","Etwa als sich moralisch überlegen fühlende Allzweckwaffe , die besonders jene von den Dächern schreien , die sich ausruhen auf ihrer Überidentifikation mit der „ Krise “ , indem sie in ihren gemütlichen Altbauwohnungen brav Gehorsam praktizieren , und alle diffamieren , die vielleicht Angst haben vor ihrem","Zuhause",", denen es dort zu eng ist oder die nicht mal eines haben ."
"821","2020-03-26","internetbasiert","Coronavirus News am Donnerstag - die wichtigsten Entwicklungen zu Sars-CoV-2 und Covid-19 - DER SPIEGEL - Wissenschaft. Derspiegel, 2020-03-26","https://www.spiegel.de/wissenschaft/medizin/coronavirus-news-am-donnerstag-die-wichtigsten-entwicklungen-zu-sars-cov-2-und-covid-19-a-557e1a81-f712-4bdb-a3a5-7df2bb9bc963",""" Bleiben Sie","Zuhause",", verhindern Sie , dass das Virus sich ausbreitet und retten Sie Leben "" , appellierte Staatschef Iván Duque an die Bürger ."
"822","2020-03-26","internetbasiert","Coronavirus News am Donnerstag - die wichtigsten Entwicklungen zu Sars-CoV-2 und Covid-19 - DER SPIEGEL - Wissenschaft. Derspiegel, 2020-03-26","https://www.spiegel.de/wissenschaft/medizin/coronavirus-news-am-donnerstag-die-wichtigsten-entwicklungen-zu-sars-cov-2-und-covid-19-a-557e1a81-f712-4bdb-a3a5-7df2bb9bc963","Die Behörden hielten Menschen jedoch an , ihr","Zuhause","nur für die Arbeit oder wichtige Gänge zu Geschäften zu verlassen ."
"823","2020-03-26","internetbasiert","Kinderleid – und niemand sieht es mehr. Tagesspiegel, 2020-03-26","https://www.tagesspiegel.de/themen/reportage/jugendaemter-schlagen-alarm-wegen-corona-lockdown-kinderleid-und-niemand-sieht-es-mehr/25682058.html","","Zuhause","aufeinander hocken , über Tage und Wochen , das gab es so noch nie ."
