"No.","Date","Genre","Bibl","URL","ContextBefore","Hit","ContextAfter"
"266","2020-05-20","internetbasiert","Bye Homeoffice? Tücken bei der Rückkehr. Apotheken Umschau, 2020-05-20","https://www.apotheken-umschau.de/Coronavirus/Bye-Homeoffice-Tuecken-bei-der-Rueckkehr-558797.html","Verkäuferinnen , Paket-Zusteller , Ärztinnen oder Polizisten : Sie alle konnten zu keiner Zeit von","Zuhause","aus arbeiten , sondern mussten weiterhin raus ."
"267","2020-05-20","internetbasiert","Rückkehr in die Büros: Wie sich Firmen auf das Ende des Homeoffice vorbereiten. Frankfurter Allgemeine Zeitung, 2020-05-20","https://www.faz.net/1.6777423","Ob von","Zuhause","oder im Büro :"
"268","2020-05-19","internetbasiert","Familienszenen als Sinnbild der Corona-Krise. https://www.merkur.de, 2020-05-19","https://www.merkur.de/lokales/fuerstenfeldbruck/fuerstenfeldbruck-ort65548/fuerstenfeldbruck-familienszenen-als-sinnbild-corona-krise-13768962.html","Überall sah sie im Vorbeigehen Menschen in ihrem","Zuhause",", wurde Zeugin vieler idyllischer Familienszenen ."
"269","2020-05-18","internetbasiert","Corona weltweit: Zahl der Toten in Brasilien steigt - Bolsonaro lässt sich von hunderten Anhängern feiern. https://www.merkur.de, 2020-05-18","https://www.merkur.de/welt/coronavirus-china-wuhan-labor-news-zahlen-infizierte-lage-tote-news-rekord-russland-brasilien-zr-13752485.html","Danach kondolierte er der Familie des Opfers in deren","Zuhause","."
"270","2020-05-18","internetbasiert","Rasanter Anstieg der Coronavirus-Infektionen in der Türkei | DW | 01.04.2020. DW.COM, 2020-05-18","https://www.dw.com/de/rasanter-anstieg-der-coronavirus-infektionen-in-der-t%C3%BCrkei/av-52986589","Denn Menschen über 65 Jahre dürfen schon seit Tagen ihr","Zuhause","nicht mehr verlassen ."
"271","2020-05-18","internetbasiert","Coronavirus: Menschen können ihre Hunde anstecken - DER SPIEGEL - Wissenschaft. Derspiegel, 2020-05-18","https://www.spiegel.de/wissenschaft/medizin/coronavirus-menschen-koennen-ihre-hunde-anstecken-a-ec3fd48a-cfaf-4782-b9ff-036da051c158","Falls die Tiere ebenfalls erkranken , sollten diese außerdem so wenig wie möglich das","Zuhause","verlassen ."
"272","2020-05-18","internetbasiert","Corona-Fall: Kirchseeoner Mittelschüler wieder zu Hause. https://www.merkur.de, 2020-05-18","https://www.merkur.de/lokales/ebersberg/kirchseeon-bayern-corona-fall-kirchseeoner-mittelschueler-wieder-zu-hause-13767268.html","Die Prüfungen zum Qualifizierenden Mittelschulabschluss seien nicht gefährdet , der Unterricht finde wieder durch Maßnahmen des "" Lernen","Zuhause",""" statt ."
"273","2020-05-18","internetbasiert","Corona-Proteste: Nichts gelernt, Angela Merkel? Kolumne von Nikolaus Blome - DER SPIEGEL - Politik. Derspiegel, 2020-05-18","https://www.spiegel.de/politik/deutschland/corona-proteste-nichts-gelernt-angela-merkel-kolumne-a-1dce0375-5efe-4949-8acf-2eae0ee45bca","Die "" alte Mittelklasse "" befürchtet dabei nicht nur die radikale Infragestellung ihrer Arbeitsplätze , Einkommen oder ihrer familiären Rollenverteilung in einem","Zuhause",", das dauerhaft Homeoffice werden soll ."
"274","2020-05-17","internetbasiert","Wirtschaftskrise: Frauen, seid dankbar. ZEIT ONLINE, 2020-05-17","https://www.zeit.de/wirtschaft/2020-05/wirtschaftskrise-frauen-coronavirus-berufe-krankenpflege-altenpflege","Wer sorgt dafür , dass die Vollzeitarbeitnehmer , die 50 , 60 , 70 Stunden die Woche im Büro verbringen , auch ein","Zuhause","haben ?"
"275","2020-05-16","internetbasiert","Auch London setzt jetzt auf Ausgangssperren | DW | 23.03.2020. DW.COM, 2020-05-16","https://www.dw.com/de/auch-london-setzt-jetzt-auf-ausgangssperren/a-52894007","","Zuhause","bleiben"
"276","2020-05-16","internetbasiert","Häusliche Gewalt: Der Kampf ihres Lebens. ZEIT ONLINE Arbeit, 2020-05-16","https://www.zeit.de/2020/21/haeusliche-gewalt-corona-lockdown-frauenhaeuser","Rösslhumer weiß , dass kein Ort für Frauen gefährlicher ist als das eigene","Zuhause","."
"277","2020-05-16","internetbasiert","Tagesdosis 16.5.2020 - Corona - Keine Atempause, Geschichte wird gemacht, es geht voran! | KenFM.de. KenFM.de, 2020-05-16","https://kenfm.de/tagesdosis-16-5-2020-corona-keine-atempause-geschichte-wird-gemacht-es-geht-voran/","Wir sollen voneinandfer Abnstand halten und uns möglichst","Zuhause","einsperren ."
"278","2020-05-15","internetbasiert","Neue alte Freizeitbeschäftigung in der Corona-Krise: Fernsehen | DW | 15.03.2020. DW.COM, 2020-05-15","https://www.dw.com/de/neue-alte-freizeitbesch%C3%A4ftigung-in-der-corona-krise-fernsehen/a-52755904","","Zuhause","bleiben und Fernsehen schauen :"
"279","2020-05-15","internetbasiert","Neue alte Freizeitbeschäftigung in der Corona-Krise: Fernsehen | DW | 15.03.2020. DW.COM, 2020-05-15","https://www.dw.com/de/neue-alte-freizeitbesch%C3%A4ftigung-in-der-corona-krise-fernsehen/a-52755904","Die Vorsitzende der Geschäftsführung der AGF Videoforschung Kerstin Niederauer-Kopf sieht dies als Hinweis , "" dass sich die Menschen abends aufgrund der aktuellen Situation derzeit mehr","Zuhause","aufhalten . """
"280","2020-05-15","internetbasiert","Neue alte Freizeitbeschäftigung in der Corona-Krise: Fernsehen | DW | 15.03.2020. DW.COM, 2020-05-15","https://www.dw.com/de/neue-alte-freizeitbesch%C3%A4ftigung-in-der-corona-krise-fernsehen/a-52755904","Zu erwarten ist aber auch , dass Streamingdienste wie Netflix oder Amazon Prime in einer Situation , in der zunehmend Menschen","Zuhause","bleiben , weiter Zulauf erfahren ."
"281","2020-05-15","internetbasiert","FREITAG – Meine Antworten auf einen Fragebogen. ortheil-blog.de, 2020-05-15","http://www.ortheil-blog.de/2020/05/15/freitag-meine-antworten-auf-einen-fragebogen/","Wo ist Ihr","Zuhause","?"
"282","2020-05-15","internetbasiert","Digitalisierung im Zeitraffer: In den USA verändert die Pandemie einige Branchen für immer | NZZ. Neue Zürcher Zeitung, 2020-05-15","https://www.nzz.ch/technologie/die-corona-krise-beschleunigt-die-digitalisierung-der-amerikanischen-gesellschaft-ld.1551309","« Ich erwarte , dass dies einen lang anhaltenden Einfluss auf die Arbeit der Zukunft haben wird – und auf das","Zuhause",". »"
"283","2020-05-14","internetbasiert","Menschen mit Behinderung in Coronakrise: Die Verletzlichen. Tazgezwitscher, 2020-05-14","https://taz.de/!5683276/","Es ist ein gemütliches","Zuhause",", mit vielen kleinen Details ."
"284","2020-05-14","internetbasiert","Werbedrehs in Zeiten von Corona: Wie aus einem Handy-Video von Eva Longoria ein TV-Spot für L’Oréal wurde. https://www.horizont.net, 2020-05-14","https://www.horizont.net/marketing/nachrichten/werbedrehs-in-zeiten-von-corona-wie-aus-einem-handy-video-von-eva-longoria-ein-tv-spot-fuerloral-wurde-183011","Authentisch statt professionell : L' Oréal Paris veröffentlicht erstmals einen Fernsehwerbespot , der während der Quarantänezeit von","Zuhause","aus in bester Insta-Story-Manier aufgenommen wurde ."
"285","2020-05-14","internetbasiert","Donald Trump pfeift auf die Meinung seines Top-Virologen – Druck der US-Regierung auf CDC. https://www.fr.de, 2020-05-14","https://www.fr.de/politik/corona-usa-donald-trump-schulen-ignoriert-warnung-anthony-fauci-zr-13746574.html","Die Lockerungen scheinen sich auch auf das individuelle Verhalten der Amerikanerinnen und Amerikaner auszuwirken , denn laut einer Analyse der „ New York Times “ verließen in der vergangenen Woche rund 25 Millionen Menschen mehr ihr","Zuhause","als üblich ."
"286","2020-05-14","internetbasiert","Menschen mit Behinderung in Coronakrise: Die Verletzlichen. Tazgezwitscher, 2020-05-14","https://taz.de/!5683276/","Es ist ein gemütliches","Zuhause",", mit vielen kleinen Details ."
"287","2020-05-14","internetbasiert","Berlin: Stadt vom Sofa. ZEIT ONLINE, 2020-05-14","https://www.zeit.de/entdecken/reisen/2020-05/berlin-mitte-stadtfuehrungen-online-coronavirus-lockdown-sehenswuerdigkeiten","Zum Beispiel mit einer Stadtführung , für die man nicht einmal sein","Zuhause","verlassen muss ."
"288","2020-05-14","internetbasiert","Coronavirus in München - Freizeit-Tipps für zuhause. Süddeutsche Zeitung, 2020-05-14","https://www.sueddeutsche.de/muenchen/corona-muenchen-freizeit-aktivitaeten-tipps-daheim-1.4850220","Unter einer neuen Rubrik "" Hellabrunn für","Zuhause",""" publiziert der Tierpark nahezu täglich auf Facebook , Instagram und Twitter Spannendes und Wissenswertes aus der Welt der Tiere ."
"289","2020-05-13","internetbasiert","Was eine Hebamme mit einer Bestatterin verbindet. Tagesspiegel, 2020-05-13","https://www.tagesspiegel.de/themen/reportage/ueber-naehe-in-zeiten-von-corona-was-eine-hebamme-mit-einer-bestatterin-verbindet/25823648.html","Dass das eigene","Zuhause",", die Beteiligung der Familie , in diesen uralten Berufen früher unhinterfragt wichtige Bestandteile waren , das ergibt gerade wieder sehr viel Sinn ."
"290","2020-05-13","internetbasiert","Melania Trump: Von der Krise wachgeküsst. Frankfurter Allgemeine Zeitung, 2020-05-13","https://www.faz.net/1.6767923","Ich habe das Weiße Haus zu einem","Zuhause","für unseren Sohn und meinen Ehemann gemacht “ , versuchte sie das Image der Verweigerin später bei einem ihrer seltenen Interviews loszuwerden ."
"291","2020-05-13","internetbasiert","Wegen Corona: Südafrika will Tausende Gefangene auf freien Fuß setzen. Frankfurter Allgemeine Zeitung, 2020-05-13","https://www.faz.net/1.6767832","„ Oft haben sie kein","Zuhause","mehr und rutschen auf der Straße schnell wieder in die Kriminalität . “"
"292","2020-05-13","internetbasiert","Lehren aus der Corona-Krise: Die Stadt braucht Dichte. Frankfurter Allgemeine Zeitung, 2020-05-13","https://www.faz.net/1.6762304","Sie geht mit städtischer Dichte und dem damit verbundenen Gefühl , in wohlproportionierten , lebendigen Straßen- und Platzräumen ein","Zuhause","gefunden zu haben , einher ."
"293","2020-05-13","internetbasiert","Lehren aus der Corona-Krise: Die Stadt braucht Dichte. Frankfurter Allgemeine Zeitung, 2020-05-13","https://www.faz.net/1.6762304","Es ist das","Zuhause","eines Miteinanders , wie wir es in diesen Pandemiezeiten so eindrücklich erleben ."
"294","2020-05-13","internetbasiert","Coronavirus: Ischgl ist Corona-frei - manager magazin. Manager Magazin, 2020-05-13","https://www.manager-magazin.de/politik/artikel/coronavirus-update-aktuelle-entwicklungen-am-mittwoch-a-1306929.html",""" Wenn unsere Beschäftigten in einer Rolle und Lage sind , die es ihnen erlauben , von","Zuhause","aus zu arbeiten , und sie für immer damit weitermachen wollen , werden wir das möglich machen "" , erklärte der Kurznachrichtendienst ."
"295","2020-05-13","internetbasiert","Coronavirus: Ischgl ist Corona-frei - manager magazin. Manager Magazin, 2020-05-13","https://www.manager-magazin.de/politik/artikel/coronavirus-update-aktuelle-entwicklungen-am-mittwoch-a-1306929.html","Facebook und Google stellen sich bisher darauf ein , dass viele ihrer Mitarbeiter noch bis Ende des Jahres von","Zuhause","aus arbeiten werden ."
"296","2020-05-13","internetbasiert","Gaming im Corona-Alltag: Warum jetzt so viel gespielt wird und welche Spiele gut für Einsteiger sind - DER SPIEGEL - Familie. Derspiegel, 2020-05-13","https://www.spiegel.de/familie/gaming-im-corona-alltag-welches-videospiel-ist-das-richtige-fuer-mich-a-0939f0c5-44e9-47e9-b24b-dd2e79fbdbd0","Von dem","Zuhause","der Großeltern aus in das Zimmer der Kinder und umgekehrt und teilweise auch mit Verzögerung ."
"297","2020-05-12","internetbasiert","Endlich allein | Mamablog. Mamablog, 2020-05-12","https://blog.derbund.ch/mamablog/index.php/88638/endlich-allein/","Für Sie wahrscheinlich erschreckend , aber Ich kenne tatsächlich viele Frauen , die die ausserordentliche Phase tatsächlich ans Limit gebracht hat , denn nicht erst jetzt war bei denen die Stimmung","Zuhause","oft zum Davonlaufen ."
"298","2020-05-12","internetbasiert","Endlich allein | Mamablog. Mamablog, 2020-05-12","https://blog.derbund.ch/mamablog/index.php/88638/endlich-allein/","Wir lesen immer mit unserer eigenen Geschichte im Hintergrund und während ich glaube , mir die letzten Wochen in Frau Sommers","Zuhause","sehr gut vorstellen zu können ( „ Mami , bitte kommst du mal !"
"299","2020-05-12","internetbasiert","Corona in den USA - Fauci über Beziehung zu Trump: „Keine Konfrontation“. https://www.fr.de, 2020-05-12","https://www.fr.de/politik/donald-trump-usa-virologe-anthony-fauci-warnt-lockerungen-corona-krise-zr-13760157.html","Update , 16:50 Uhr : Nach der fünfminüten Aussage Anthony Faucis geben zunächst die anderen drei Zeugen ihre Statements - bislang alle per Video , mutmaßlich von","Zuhause","."
"300","2020-05-12","internetbasiert","Coronavirus: Ist Sport im Freien gesund oder ein Risiko? | DW | 03.04.2020. DW.COM, 2020-05-12","https://www.dw.com/de/coronavirus-ist-sport-im-freien-gesund-oder-ein-risiko/a-52963044","Auf der britischen Insel ist eine Form von sportlicher Aktivität pro Tag erlaubt , bei der man "" lokal bleiben "" soll , in Frankreich sei "" ein bisschen sportliche Aktivität "" erlaubt , betont Staatspräsident Emmanuel Macron , allerdings nur im engen Umkreis ums eigene","Zuhause","."
"301","2020-05-12","internetbasiert","Coronavirus: Ist Sport im Freien gesund oder ein Risiko? | DW | 03.04.2020. DW.COM, 2020-05-12","https://www.dw.com/de/coronavirus-ist-sport-im-freien-gesund-oder-ein-risiko/a-52963044","Zusammengefasst :","Zuhause","oder dort , wo nur wenige Menschen sind ."
"302","2020-05-12","internetbasiert","Coronavirus: Ist Sport im Freien gesund oder ein Risiko? | DW | 03.04.2020. DW.COM, 2020-05-12","https://www.dw.com/de/coronavirus-ist-sport-im-freien-gesund-oder-ein-risiko/a-52963044","Solche Szenen rufen auch die Politik auf den Plan : "" Im Moment ist es einfach ein Risiko , wenn sich zu viele Menschen zusammenrotten und joggen gehen , auch wenn sie ursprünglich mal alleine von","Zuhause","aus losgelaufen sind "" , warnt Dagmar Freitag ( SPD ) , die den Sportausschuss im Deutschen Bundestag leitet ."
"303","2020-05-12","internetbasiert","Corona-Reproduktionsrate steigt wieder über kritischen Wert 1 | DW | 09.05.2020. DW.COM, 2020-05-12","https://www.dw.com/de/corona-reproduktionsrate-steigt-wieder-%C3%BCber-kritischen-wert-1/a-53383243","""","Zuhause","bleiben "" , lautet die Devise ."
"304","2020-05-12","internetbasiert","Obdachlosigkeit: Pandemie, ganz unten. ZEIT ONLINE Arbeit, 2020-05-12","https://www.zeit.de/2020/20/obdachlosigkeit-corona-krise-armut-pandemie-krankheit-wohnungslosigkeit","In Deutschland haben 700.000 Menschen kein","Zuhause",", schätzt die Bundesarbeitsgemeinschaft Wohnungslosenhilfe : Flüchtlinge , EU-Bürger und Deutsche , die ihre Wohnung verloren haben ."
"305","2020-05-12","internetbasiert","Obdachlosigkeit: Pandemie, ganz unten. ZEIT ONLINE Arbeit, 2020-05-12","https://www.zeit.de/2020/20/obdachlosigkeit-corona-krise-armut-pandemie-krankheit-wohnungslosigkeit","Schließlich ist die Gesellschaft auf die zügige Registrierung von Covid-19-Neuinfektionen und die verlässliche Nachverfolgung von Ansteckungsketten angewiesen – doch zugleich lässt sie zu , dass Hunderttausende Menschen kein","Zuhause","haben , um sich zu isolieren ."
"306","2020-05-12","internetbasiert","Havas Media Corona Monitor: Kurzarbeit beflügelt die Mediennutzung, Maskenpflicht das Online-Shopping. https://www.horizont.net, 2020-05-12","https://www.horizont.net/marketing/nachrichten/havas-media-corona-monitor-kurzarbeit-befluegelt-die-mediennutzung-maskenpflicht-das-online-shopping-182898","Produkten , die dazu dienen , das eigene","Zuhause","schöner zu gestalten oder sauber zu halten , kommt dadurch ein gesteigertes Interesse zu - allen voran der Staubsaugerroboter ."
"307","2020-05-12","internetbasiert","Mit dem Herzschlag gegen Corona | DW | 07.04.2020. DW.COM, 2020-05-12","https://www.dw.com/de/mit-dem-herzschlag-gegen-corona/a-53049952","""","Zuhause","bleiben "" , lautet die Devise ."
"308","2020-05-12","internetbasiert","Weniger Verkehrsunfälle in Corona-Zeiten. N-Tv Nachrichten, 2020-05-12","https://www.n-tv.de/panorama/Weniger-Verkehrsunfaelle-in-Corona-Zeiten-article21774303.html","Die strengen Beschränkungen in der Corona-Pandemie haben dazu geführt , dass Menschen ihr","Zuhause","in den vergangenen Wochen weniger verlassen haben ."
"309","2020-05-12","internetbasiert","Corona-Krise führt zu weniger Verkehrsunfällen. https://www.merkur.de, 2020-05-12","https://www.merkur.de/welt/corona-krise-fuehrt-zu-weniger-verkehrsunfaellen-zr-13759552.html","Homeoffice und Kontaktverbote haben dazu geführt , dass Menschen ihr","Zuhause","in den vergangenen Wochen weniger verlassen haben ."
"310","2020-05-12","internetbasiert","Wie Kriminelle die Corona-Krise ausnutzen. Apotheken Umschau, 2020-05-12","https://www.apotheken-umschau.de/Coronavirus/Wie-Kriminelle-die-Corona-Krise-ausnutzen-558677.html","Dadurch , dass vorerst viele Menschen von","Zuhause","aus arbeiten , gebe es mehr Gelegenheiten , um beispielsweise in Rechner einzudringen und an wertvolle Daten zu gelangen , erklärte Stock ."
"311","2020-05-12","internetbasiert","Coronakrise: Weltraumforschung auf Abstand – geht das?. Panorama, 2020-05-12","https://www.zdf.de/uri/d69e7e26-554f-4104-9a56-7eb6dd7199b8","Was tun","Zuhause","und wie hält man in der Isolation Kontakt zu anderen ?"
"312","2020-05-12","internetbasiert","Corona-Krise führt zu weniger Verkehrsunfällen. Heise Online, 2020-05-12","https://www.heise.de/newsticker/meldung/Corona-Krise-fuehrt-zu-weniger-Verkehrsunfaellen-4719064.html","Homeoffice und Kontaktverbote haben dazu geführt , dass Menschen ihr","Zuhause","in den vergangenen Wochen weniger verlassen haben ."
"313","2020-05-12","internetbasiert","Fahrplan für Kita-Öffnungen in Berlin: Maximal vier Stunden pro Tag. Tazgezwitscher, 2020-05-12","https://taz.de/!5685467/","Allerdings sei es schwierig für die , die nicht von","Zuhause","aus arbeiten können und bereits einen höheren Stundenumfang in der Notbetreuung hatten ."
"314","2020-05-11","internetbasiert","Corona und Anstieg häuslicher Gewalt: Schattenpandemie. Tazgezwitscher, 2020-05-11","https://taz.de/!5681591/","Der gefährlichste Ort für Frauen ist das eigene","Zuhause","."
"315","2020-05-11","internetbasiert","Corona und Anstieg häuslicher Gewalt: Schattenpandemie. Tazgezwitscher, 2020-05-11","https://taz.de/!5681591/","Die Tatsache , dass der gefährlichste Ort für Frauen nicht die nächtliche Straße ist , sondern ihr eigenes","Zuhause",", bewahrheitet sich in Coronazeiten ."
"316","2020-05-11","internetbasiert","Coronavirus in Zürich: Der Tag der grossen Öffnung live. Neue Zürcher Zeitung, 2020-05-11","https://www.nzz.ch/zuerich/coronavirus-in-zuerich-der-tag-der-grossen-oeffnung-live-ld.1555509","Als angenehm dichtestressfrei erweist sich die Option , den Weg zwischen dem","Zuhause","in der Zürcher Enge und dem Bellevue mit dem E-Trottinett zurückzulegen :"
"317","2020-05-11","internetbasiert","Corona und Anstieg häuslicher Gewalt: Schattenpandemie. Tazgezwitscher, 2020-05-11","https://taz.de/!5681591/","Der gefährlichste Ort für Frauen ist das eigene","Zuhause","."
"318","2020-05-11","internetbasiert","Corona und Anstieg häuslicher Gewalt: Schattenpandemie. Tazgezwitscher, 2020-05-11","https://taz.de/!5681591/","Die Tatsache , dass der gefährlichste Ort für Frauen nicht die nächtliche Straße ist , sondern ihr eigenes","Zuhause",", bewahrheitet sich in Coronazeiten ."
"319","2020-05-11","internetbasiert","Corona und Anstieg häuslicher Gewalt: Schattenpandemie. Tazgezwitscher, 2020-05-11","https://taz.de/!5681591/","Der gefährlichste Ort für Frauen ist das eigene","Zuhause","."
"320","2020-05-11","internetbasiert","Corona und Anstieg häuslicher Gewalt: Schattenpandemie. Tazgezwitscher, 2020-05-11","https://taz.de/!5681591/","Die Tatsache , dass der gefährlichste Ort für Frauen nicht die nächtliche Straße ist , sondern ihr eigenes","Zuhause",", bewahrheitet sich in Coronazeiten ."
"321","2020-05-11","internetbasiert","Corona-Krise: Frauen und Kinder brauchen jetzt mehr Schutz. https://www.fr.de, 2020-05-11","https://www.fr.de/meinung/corona-krise-frauen-kinder-brauchen-mehr-schutz-13757365.html","Doch das","Zuhause","ist nicht für jeden Menschen ein sicherer Raum ."
"322","2020-05-11","internetbasiert","Corona-Krise: Frauen und Kinder brauchen jetzt mehr Schutz. https://www.fr.de, 2020-05-11","https://www.fr.de/meinung/corona-krise-frauen-kinder-brauchen-mehr-schutz-13757365.html","Heute startet #StärkerAlsGewalt zusammen mit 26.000 Supermärkten die Aktion „","Zuhause","nicht sicher ? “ , um auf #HäuslicheGewalt während Corona aufmerksam zu machen ."
"323","2020-05-11","internetbasiert","Corona-Hilfen für Start-ups: Geld ist da, aber hilft es den Richtigen?. ZEIT ONLINE, 2020-05-11","https://www.zeit.de/digital/internet/2020-05/coronavirus-hilfen-start-ups-unternehmensgruendung-hilfsprogramme","Die Tech-Giganten profitieren jedenfalls von einer berührungslosen Zukunft , denn sie sind Mittler zwischen dem isolierten","Zuhause","und der immer ungemütlicher werdenden Außenwelt ."
"324","2020-05-11","internetbasiert","COVID-19 Spezial vom 27.04.2020 | DW | 27.04.2020. DW.COM, 2020-05-11","https://www.dw.com/de/covid-19-spezial-vom-27042020/av-53261408","COVID-19 verschärft die soziale Ungleichheit in Mexiko +++ Irans Tourismusbranche kämpft ums Überleben +++ Epidemiologe Dirk Brockmann über mögliche Lockerungen im Flugverkehr +++ und : Menschen aus Afrika berichten über ihr Schicksal fernab von","Zuhause",""
"325","2020-05-11","internetbasiert","Update am Morgen: Das weiß doch jeder #Covidiot!. Zweites Deutsches Fernsehen, 2020-05-11","https://www.zdf.de/uri/06e18676-2f25-4b83-aaca-082bf911d3b4","was sind Sie : Team ""","Zuhause","bleiben "" oder Team "" Raus auf die Straße "" ?"
"326","2020-05-11","internetbasiert","Coronavirus: Wie die Seuche die USA erfasst - DER SPIEGEL - Politik. Derspiegel, 2020-05-11","https://www.spiegel.de/politik/ausland/coronavirus-wie-die-seuche-die-usa-erfasst-a-593bd913-84f9-44a2-b834-2c8734c40e5a","Insbesondere Menschen in New York , Detroit und Chicago verlassen kaum mehr ihr","Zuhause","."
"327","2020-05-11","internetbasiert","Telefonseelsorge: ""Es ist meine Aufgabe, das auszuhalten"". ZEIT ONLINE, 2020-05-11","https://www.zeit.de/hamburg/2020-04/telefonseelsorge-coronavirus-pandemie-anrufer","Dann spürt sie , was die Seelsorge für sie ist : "" ein zweites","Zuhause",""" ."
"328","2020-05-11","internetbasiert","Interview: “Für viele Frauen im Irak ist die Quarantäne schon lange Lebensrealität”. Solidarisch gegen Corona, 2020-05-11","https://solidarischgegencorona.wordpress.com/2020/05/11/interview-fur-viele-frauen-im-irak-ist-die-quarantane-schon-lange-lebensrealitat/","Für viele Frauen im Irak bedeutet die Ausgangssperre wiederum , dass sie den ganzen Tag mit ihren Ehemännern und oft auch dessen Familie","Zuhause","eingesperrt sind ."
"329","2020-05-11","internetbasiert","Interview: “Für viele Frauen im Irak ist die Quarantäne schon lange Lebensrealität”. Solidarisch gegen Corona, 2020-05-11","https://solidarischgegencorona.wordpress.com/2020/05/11/interview-fur-viele-frauen-im-irak-ist-die-quarantane-schon-lange-lebensrealitat/","Feministische Stimmen kritisierten , dass für Frauen das","Zuhause","oft ein Ort der Gewalt ist ."
"330","2020-05-10","internetbasiert","Warum die Coronakrise Ungleichheit verstärkt. Tagesspiegel, 2020-05-10","https://www.tagesspiegel.de/wirtschaft/die-risiken-sind-ungleich-verteilt-warum-die-coronakrise-ungleichheit-verstaerkt/25815662.html","Und er kann von","Zuhause","aus arbeiten – während gerade viele Menschen mit niedrigem Einkommen ihren Job verlieren oder in Kurzarbeit geschickt werden ."
"331","2020-05-10","internetbasiert","Warum die Coronakrise Ungleichheit verstärkt. Tagesspiegel, 2020-05-10","https://www.tagesspiegel.de/wirtschaft/die-risiken-sind-ungleich-verteilt-warum-die-coronakrise-ungleichheit-verstaerkt/25815662.html","So haben zuletzt 40 Prozent der Deutschen mit einem hohen Schulabschluss von","Zuhause","aus gearbeitet , während das unter denjenigen mit einem niedrigen Abschluss gerade einmal sechs Prozent möglich war ."
"332","2020-05-10","internetbasiert","Blick vom Balkon. blogs.taz.de, 2020-05-10","https://blogs.taz.de/latinorama/blick-aus-dem-fenster/","","Zuhause","eingeschlossen können die Frauen jetzt noch weniger Gehör finden und Hilfe einfordern ."
"333","2020-05-09","internetbasiert","Corona-Krise: EU-Kommission für Verlängerung des Einreisestopps bis 15. Juni. https://www.fr.de, 2020-05-09","https://www.fr.de/panorama/corona-krise-weltweit-eu-kommisions-einreisestopp-zr-13597264.html","„ Heute bin ich so glücklich , dass wir zusammen eine Welt","Zuhause","sind “ , sagte Lady Gaga , Mitorganisatorin der Show , zum Auftakt von „ One World :"
"334","2020-05-09","internetbasiert","Corona-Krise: EU-Kommission für Verlängerung des Einreisestopps bis 15. Juni. https://www.fr.de, 2020-05-09","https://www.fr.de/panorama/corona-krise-weltweit-eu-kommisions-einreisestopp-zr-13597264.html","Zuvor hatten sich bei einem sechsstündigen Livestream Dutzende Musiker , Sportler und andere Künstler , darunter die SängerAdam Lambert , Jennifer Hudson und Rita Ora , von","Zuhause","mit Auftritten zugeschaltet ."
"335","2020-05-09","internetbasiert","Corona-Krise: EU-Kommission für Verlängerung des Einreisestopps bis 15. Juni. https://www.fr.de, 2020-05-09","https://www.fr.de/panorama/corona-krise-weltweit-eu-kommisions-einreisestopp-zr-13597264.html","Dabei ist für manche Frauen inSpaniendas eigene","Zuhause","ohnehin ein unsicherer Ort ."
