"No.","Date","Genre","Bibl","URL","ContextBefore","Hit","ContextAfter"
"548","2020-04-17","internetbasiert","Abenteuer per VR-Brille in Corona-Zeiten: Die ""Simpsons"" auf dem Sofa - DER SPIEGEL - Panorama. Derspiegel, 2020-04-17","https://www.spiegel.de/panorama/gesellschaft/corona-krise-bei-den-simpsons-abenteuer-per-vr-brille-auf-dem-sofa-a-a1495612-ae9d-4abe-b41e-1696dfd063fc","Die Botschaft in Kürze :","Zuhause","ist es am schönsten und sichersten ."
"549","2020-04-16","internetbasiert","So verwandeln Sie Ihr Zuhause in ein Fitnessstudio - DER SPIEGEL - Fitness. Derspiegel, 2020-04-16","https://www.spiegel.de/fitness/sport-in-der-coronakrise-so-verwandeln-sie-ihr-zuhause-in-ein-fitnessstudio-a-6532dce4-554b-4a81-a7cb-35e12c5578ca","In Corona-Zeiten gewinnt das","Zuhause","noch mehr an Bedeutung , nicht nur beim Leben , Lieben , Lernen , Streiten und Arbeiten , sondern auch beim Sport ."
"550","2020-04-16","internetbasiert","Traumhochzeit trotz Coronakrise: Froonck gibt Tipps für Brautpaare - DER SPIEGEL - Partnerschaft. Derspiegel, 2020-04-16","https://www.spiegel.de/partnerschaft/hochzeit-in-der-corona-krise-froonck-mit-tipps-fuer-die-traumhochzeit-a-d6516d39-7970-4609-b9f3-8d195da88f09","Dann könnte man das","Zuhause","auf dem großen Screen abspielen und dann zu zweit richtig abtanzen und richtig feiern ."
"551","2020-04-16","internetbasiert","Nein, die Bundesregierung zahlt keine Prämie für das Zuhausebleiben. correctiv.org, 2020-04-16","https://correctiv.org/faktencheck/2020/04/16/nein-die-bundesregierung-zahlt-keine-praemie-fuer-das-zuhausebleiben-waehrend-der-corona-pandemie/","„ Die Deutsche Regierung belohnt das","Zuhause","bleiben mit einer einmaligen Zahlung in Höhe von 1200,00€ pro Person !!"
"552","2020-04-16","internetbasiert","Multiple Sklerose und Corona: Was beachten?. Apotheken Umschau, 2020-04-16","https://www.apotheken-umschau.de/Coronavirus/Multiple-Sklerose-und-Corona-Was-beachten--558207.html","","Zuhause","bleiben und den Kontakt zu anderen Menschen so gut es geht meiden ."
"553","2020-04-16","internetbasiert","Das Corona-Tagebuch: Vierfüßlerstand mit Mundschutz: Corona-Alltag in einer Rehaklinik | BR.de. Br_Presse, 2020-04-16","https://br.de/s/4TLi69L","","Zuhause","angekommen freue ich mich über die handgemachte Kollektion Mundschützemade bymeiner Mutter :"
"554","2020-04-16","internetbasiert","In den Late-Night-Shows ist Casual Corona Wear angesagt. Tagesspiegel, 2020-04-16","https://www.tagesspiegel.de/kultur/aus-dem-homeoffice-in-den-late-night-shows-ist-casual-corona-wear-angesagt/25747542.html","Seit Colbert , Meyers , Noah , Kimmel , Fallon & Co aber von","Zuhause","senden , sozusagen Einblicke in ihre Privatleben gewähren , sind sie uns noch ein wenig näher gekommen ."
"555","2020-04-16","internetbasiert","Das große Berliner Obdachlosen-Unterbringungs-Wunder. Tagesspiegel, 2020-04-16","https://www.tagesspiegel.de/themen/reportage/200-menschen-in-coronavirus-obhut-das-grosse-berliner-obdachlosen-unterbringungs-wunder/25743588.html","Mieszko , 44 Jahre alt , Bett Nummer 343 , strahlt nicht aus , dass er kein","Zuhause","hat ."
"556","2020-04-16","internetbasiert","Das große Berliner Obdachlosen-Unterbringungs-Wunder. Tagesspiegel, 2020-04-16","https://www.tagesspiegel.de/themen/reportage/200-menschen-in-coronavirus-obhut-das-grosse-berliner-obdachlosen-unterbringungs-wunder/25743588.html","Und so mag das","Zuhause","auf Zeit vielleicht ein Wunder sein ."
"557","2020-04-15","internetbasiert","24h-Pflege und Corona: Arbeiterinnen sitzen fest. Solidarisch gegen Corona, 2020-04-15","https://solidarischgegencorona.wordpress.com/2020/04/15/24h-pflege-und-corona-arbeiterinnen-sitzen-fest/","Sie betreuen vor allem alte Menschen in deren","Zuhause","."
"558","2020-04-15","internetbasiert","Freunde der Arche: Hilfe kommt durchs Fenster. Frankfurter Allgemeine Zeitung, 2020-04-15","https://www.faz.net/1.6724958","Seit diese aber geschlossen seien , müssten die Kinder","Zuhause","versorgt werden , sagt Schröder ."
"559","2020-04-15","internetbasiert","Lösungen hacken in der Coronakrise | DW | 30.04.2020. DW.COM, 2020-04-15","https://www.dw.com/de/l%C3%B6sungen-hacken-in-der-coronakrise/a-53295894","Eben weil sich alle virtuell treffen und von","Zuhause","aus nach Lösungen suchen könnten ."
"560","2020-04-15","internetbasiert","Wahlkampf in der Pandemie: Erst muss noch Trumps Name auf die Nothilfe-Schecks. Frankfurter Allgemeine Zeitung, 2020-04-15","https://www.faz.net/1.6726168","Es arbeite nun von","Zuhause","an der Änderung , was nach Angaben von zwei IRS-Mitarbeitern sehr wahrscheinlich doch zu Verzögerungen führen werde ."
"561","2020-04-15","internetbasiert","Die News am Mittwoch: Die wichtigsten Entwicklungen zum Coronavirus - DER SPIEGEL - Wissenschaft. Derspiegel, 2020-04-15","https://www.spiegel.de/wissenschaft/medizin/coronavirus-news-am-mittwoch-die-wichtigsten-entwicklungen-zu-sars-cov-2-und-covid-19-a-14749a2d-0ea2-41c8-8897-5bd375376f9c",""" Im Schatten von Covid-19 sind die Leben von Millionen Kindern vorübergehend auf ihr","Zuhause","und ihren Bildschirm zusammengeschrumpft "" , sagte Unicef-Chefin Henrietta Fore ."
"562","2020-04-15","internetbasiert","Corona in den USA: Trump stoppt WHO-Zahlungen - Mehr als 2200 Tote binnen 24 Stunden. https://www.fr.de, 2020-04-15","https://www.fr.de/panorama/corona-krise-usa-donald-trump-stoppt-who-beitragszahlungen-zr-13599298.html","Alle Bürger sind aufgerufen ,","Zuhause","zu bleiben , „ nicht lebenswichtige “ Einrichtungen und Firmen sind geschlossen ."
"563","2020-04-15","internetbasiert","Corona in den USA: Trump stoppt WHO-Zahlungen - Mehr als 2200 Tote binnen 24 Stunden. https://www.fr.de, 2020-04-15","https://www.fr.de/panorama/corona-krise-usa-donald-trump-stoppt-who-beitragszahlungen-zr-13599298.html","Alle Bürger sind aufgerufen ,","Zuhause","zu bleiben ."
"564","2020-04-15","internetbasiert","Misstrauen in Spanien: „Wegen uns habt ihr noch zu essen“. Frankfurter Allgemeine Zeitung, 2020-04-15","https://www.faz.net/1.6726651","„ Deine Nachbarn möchten Dich um unser aller willen bitten , ein anderes","Zuhause","zu suchen ."
"565","2020-04-14","internetbasiert","Nic Baschung in «Ein Monat Corona in der Republik – und jetzt?». RepublikMagazin, 2020-04-14","https://www.republik.ch/2020/04/14/ein-monat-corona-in-der-republik-und-jetzt/diskussion?focus=81e1f8e6-ff07-43fc-8385-b7337f8ddd64","Wie die Krise Menschen trifft , die kein","Zuhause","haben , und wie die Pandemie den Pflegenotstand verschlimmert"
"566","2020-04-14","internetbasiert","Corona-Krise: Darum leiden junge Menschen jetzt besonders. Panorama, 2020-04-14","https://www.zdf.de/uri/285c2548-729a-461a-ace8-b1e6b06c62ee","Alle müssen","Zuhause","bleiben :"
"567","2020-04-14","internetbasiert","Marktforschung - Coronavirus macht weltweiter PC-Branche zu schaffen. Cash, 2020-04-14","https://www.cash.ch/news/top-news/marktforschung-coronavirus-macht-weltweiter-pc-branche-zu-schaffen-1523684","Dann konnte die Branche der weltweit gestiegenen Nachfrage für Ausrüstung für Unterricht und Arbeit von","Zuhause","nicht nachkommen , erklärten die Marktforscher in ihrer Studie ."
"568","2020-04-14","internetbasiert","Corona-Exit in Kitas und Schulen: Unlogisch und unverantwortlich!. Tazgezwitscher, 2020-04-14","https://taz.de/!5678060/","Bedenkt bitte , der soziale Schaden bei den Kleinsten ist am Größten , die haben auch ihren Freundeskreis , der ihnen nun verwehrt wird , die Betreuung ist für viele ein zweites","Zuhause","!"
"569","2020-04-14","internetbasiert","Coronavirus: Marktforscher uneins über Auswirkungen auf PC-Absatz. Heise Online, 2020-04-14","https://www.heise.de/newsticker/meldung/Coronavirus-Marktforscher-uneins-ueber-Auswirkungen-auf-PC-Absatz-4701789.html","","Zuhause","festsitzende Verbraucher haben sich damit anfreunden müssen , wie wichtig ( zeitgemäße technische Geräte ) sind ."
"570","2020-04-14","internetbasiert","Corona-Exit in Kitas und Schulen: Unlogisch und unverantwortlich!. Tazgezwitscher, 2020-04-14","https://taz.de/!5678060/","Bedenkt bitte , der soziale Schaden bei den Kleinsten ist am Größten , die haben auch ihren Freundeskreis , der ihnen nun verwehrt wird , die Betreuung ist für viele ein zweites","Zuhause","!"
"571","2020-04-14","internetbasiert","Update am Abend: Menschliche und wirtschaftliche Gesundheit. Zweites Deutsches Fernsehen, 2020-04-14","https://www.zdf.de/uri/823ade0e-c00e-4101-bc31-f9d9868f3e1b","InSüdafrikagilt eine der strengsten Ausgangssperren der Welt - nur für das Lebensnotwendigste darf man sein","Zuhause","verlassen ."
"572","2020-04-14","internetbasiert","Update am Abend: Menschliche und wirtschaftliche Gesundheit. Zweites Deutsches Fernsehen, 2020-04-14","https://www.zdf.de/uri/823ade0e-c00e-4101-bc31-f9d9868f3e1b","In Südafrika gilt eine der strengsten Ausgangssperren der Welt – nur für das Lebensnotwendigste darf man sein","Zuhause","verlassen ."
"573","2020-04-14","internetbasiert","Corona-Hilfskrankenhaus: Sie sind bereit für die nächste Welle. Merkur.de, 2020-04-14","https://www.merkur.de/lokales/dachau/dachau-ort28553/dachau-coronavirus-hilfskrankenhaus-betriebsbereit-hotel-13651332.html","Dachau– Ab sofort stehen 99 sauerstoffversorgte Betten im neuen Corona-Hilfskrankenhaus in der Newtonstraße zur Verfügung – für Patienten , „ denen es zu gut geht für das Krankenhaus und zu schlecht für","Zuhause","“ , wie Professor Dr. Hjalmar Hagedorn , Ärztlicher Direktor des Helios Amper-Klinikums , erklärt ."
"574","2020-04-14","internetbasiert","Nach Corona: Ein sinnvoller Neustart. Heise Online, 2020-04-14","https://www.heise.de/tp/features/Nach-Corona-Ein-sinnvoller-Neustart-4701504.html","Beispielsweise wird in der Corona-Krise jetzt verstärkt im Homeoffice von","Zuhause","aus gearbeitet ."
"575","2020-04-14","internetbasiert","Nach Corona: Ein sinnvoller Neustart. Heise Online, 2020-04-14","https://www.heise.de/tp/features/Nach-Corona-Ein-sinnvoller-Neustart-4701504.html","Die Einkäufe werden im Auto gesammelt und erst","Zuhause","ausgeladen ."
"576","2020-04-14","internetbasiert","Zattoo-Analyse: Wie das Coronavirus den TV-Konsum in der Schweiz verändert. https://www.horizont.net, 2020-04-14","https://www.horizont.net/schweiz/nachrichten/zattoo-analyse-wie-das-coronavirus-den-tv-konsum-in-der-schweiz-veraendert-182295","Die Angst vor einer Ansteckung , soziale Distanzierung , aber vor allem Quarantänen und Ausgangssperren – fast alle Menschen verbringen derzeit ihre gesamte Zeit","Zuhause","und wollen sich über aktuelle Entwicklungen auf dem Laufenden halten ."
"577","2020-04-14","internetbasiert","Zattoo-Analyse: Wie das Coronavirus den TV-Konsum in der Schweiz verändert. https://www.horizont.net, 2020-04-14","https://www.horizont.net/schweiz/nachrichten/zattoo-analyse-wie-das-coronavirus-den-tv-konsum-in-der-schweiz-veraendert-182295","Besonders ausgeprägt ist das Wachstum auf dem grossen Bildschirm","Zuhause",", wodurch der Anteil der auf Connected-TVs gestreamten Stunden weiter steigt ."
"578","2020-04-14","internetbasiert","Susanne Gaschke fragt sich, ob Corona der neue Hitler ist | Übermedien. Übermedien, 2020-04-14","https://uebermedien.de/48355/susanne-gaschke-fragt-sich-ob-corona-der-neue-hitler-ist/","Wenn ich deshalb Abstand halte , nicht auf Partys gehe und von","Zuhause","aus arbeite , dann tue ich das"
"579","2020-04-14","internetbasiert","Coronavirus: Wie Ironman-Sieger Jan Frodeno und andere Sportler Zuhause trainieren - manager magazin. Manager Magazin, 2020-04-14","https://www.manager-magazin.de/lifestyle/fitness/coronavirus-wie-ironman-sieger-jan-frodeno-und-andere-sportler-zuhause-trainieren-a-1306245.html","Sportler weltweit präsentieren sich in diesen Zeiten in den sozialen Medien in ihrem","Zuhause","."
"580","2020-04-14","internetbasiert","Kampf um Tripolis: Offensive im Windschatten der Pandemie. Frankfurter Allgemeine Zeitung, 2020-04-14","https://www.faz.net/1.6725148","„ In einer Zeit , in der die Menschen in Libyen nichts mehr als ein sicheres","Zuhause","und funktionierende medizinische Einrichtungen brauchten , erhielten wir die Nachricht von einem weiteren Angriff auf ein Krankenhaus . “"
"581","2020-04-14","internetbasiert","Coronakrise trifft PC-Branche hart | Anlagestrategie News | boerse.ARD.de. boerse.ARD.de, 2020-04-14","https://boerse.ard.de/anlagestrategie/branchen/coronakrise-trifft-pc-branche-hart100.html","Dann konnte die Branche der weltweit gestiegenen Nachfrage für Equipment für Unterricht und Arbeit von","Zuhause","nicht nachkommen , erklärten die Marktforscher in ihrer Studie ."
"582","2020-04-13","internetbasiert","Gesundheitssystem Überfordert: Schockierende Corona-Odyssee in Berlin - WELT. DIE WELT, 2020-04-13","https://www.welt.de/politik/ausland/plus207147263/Gesundheitssystem-Ueberfordert-Schockierende-Corona-Odyssee-in-Berlin.html","Wäre die Sache mit dem","Zuhause","nur so einfach – und wäre das Vorhängeschloss nicht am Tor des Krankenhauses angebracht worden , in dem meine Frau mit meinem neugeborenen Sohn auf den Armen auf mich wartet ."
"583","2020-04-13","internetbasiert","„Normalität nur für einige, aber nicht für alle? Das wäre entmündigend“. Tagesspiegel, 2020-04-13","https://www.tagesspiegel.de/kultur/carolin-emcke-zur-coronakrise-normalitaet-nur-fuer-einige-aber-nicht-fuer-alle-das-waere-entmuendigend/25737142.html","Das ist schon auch mein","Zuhause","."
"584","2020-04-13","internetbasiert","Rassismus-Vorwürfe: „Sie finden heute keine Schwarzen auf der Straße in Guangzhou“. Frankfurter Allgemeine Zeitung, 2020-04-13","https://www.faz.net/1.6723546","„ Das hier ist mein zweites","Zuhause","“ , sagt der Mann , der seit mehr als zehn Jahren in China lebt ."
"585","2020-04-13","internetbasiert","Frankreich verlängert die Ausgangssperre. N-Tv Nachrichten, 2020-04-13","https://www.n-tv.de/politik/Frankreich-verlaengert-die-Ausgangssperre-article21710911.html","Der Verein , der vor drei Wochen seine mehr als 60 Tierheime schließen musste , hatte die Regierung um eine Ausnahmegenehmigung gebeten , da in zahlreichen überfüllten Tierheimen tausende Tiere auf ein neues","Zuhause","warteten ."
"586","2020-04-12","internetbasiert","Häusliche Gewalt in der Coronakrise: Wenn Nähe zur Gefahr wird - DER SPIEGEL - Panorama. Derspiegel, 2020-04-12","https://www.spiegel.de/panorama/gesellschaft/haeusliche-gewalt-in-der-corona-krise-wenn-naehe-zur-gefahr-wird-a-3fb50469-4fdb-4ab4-a001-e81377e7f3e3","Anika Ziemba , Autonome Frauenhäuser Hamburg "" Das eigene","Zuhause","wird ja oft als der Inbegriff von Sicherheit gewertet , Frauen lernen ja immer wieder , dass es nachts draußen im Dunkeln gefährlich ist für sie , da muss dann immer der Park herhalten ."
"587","2020-04-12","internetbasiert","Ostersegen aus dem Hubschrauber. blogs.taz.de, 2020-04-12","https://blogs.taz.de/latinorama/ostersegen-aus-dem-hubschrauber/","","Zuhause","zu bleiben , um die Gesundheit zu schützen , dürfe keineswegs heißen , still zu sein und den Mund zu halten , hält María Galindo in ihrem Radioprogramm von Mujeres Creando in La Paz der verbreiteten Sprachlosigkeit entgegen ."
"588","2020-04-12","internetbasiert","Hilfe in der Corona-Krise: Und plötzlich hilft der Fußballstar im Supermarkt. Frankfurter Allgemeine Zeitung, 2020-04-12","https://www.faz.net/1.6722301","„ Selten hab ich so viel Dankbarkeit erlebt , als wenn ich Frau E. ( seit 9 Wochen","Zuhause","! ) ihr Paket in den 3. Stock trage und sie mich fragt , ob ich auch ja nächste Woche wieder kommen könnte . “"
"589","2020-04-12","internetbasiert","Corona-Maßnahmen: Laschet im ZDF-Interview zu Lockerungen. Politik, 2020-04-12","https://www.zdf.de/uri/5bc26241-38e6-4c52-b9be-632d9ad1f24f","Wenn","Zuhause","kein sicherer Ort ist - wie dieCorona-Krise das Kindeswohlgefährdet :"
"590","2020-04-12","internetbasiert","Corona-Maßnahmen: Laschet im ZDF-Interview zu Lockerungen. Politik, 2020-04-12","https://www.zdf.de/uri/5bc26241-38e6-4c52-b9be-632d9ad1f24f","Alle müssen","Zuhause","bleiben :"
"591","2020-04-12","internetbasiert","Harry und Meghan ziehen schon wieder um: Insider haben nur eine Erklärung - und sie ist zuckersüß. https://www.merkur.de, 2020-04-12","https://www.merkur.de/boulevard/donald-trump-harry-meghan-baby-los-angeles-royals-corona-umzug-kanada-usa-los-angeles-zr-13634237.html","Auch wenn sich das Paar angesichts der Corona-Pandemie momentan wohl nicht groß aus seinem","Zuhause","wagen würde , möchte das einstige Prinzenpaar angeblich künftig in Meghans Heimatstadt Los Angeles leben ."
"592","2020-04-12","internetbasiert","Maskenpflicht in Israel wegen Coronavirus-Ausbreitung. Cash, 2020-04-12","https://www.cash.ch/news/politik/maskenpflicht-israel-wegen-coronavirus-ausbreitung-1522922","Die Menschen in Israel sind angewiesen , sich nicht mehr als 100 Meter von ihrem","Zuhause","zu entfernen ."
"593","2020-04-12","internetbasiert","Maskenpflicht: Israel verschärft Corona-Maßnahmen. Panorama, 2020-04-12","https://www.zdf.de/uri/373cd6c8-351a-432d-a0f3-7b1a5f4557a4","Die Israelis dürfen sich nicht mehr als 100 Meter von ihrem","Zuhause","entfernen ."
"594","2020-04-12","internetbasiert","Coronavirus: Obdachlose in den USA schutzlos ausgeliefert. Panorama, 2020-04-12","https://www.zdf.de/uri/731a9ed8-f08d-4969-9532-986b1b631650","Social Distancing , Maske tragen , häusliche Quarantäne und regelmäßig Hände waschen - an diese Maßnahmen gegen die Ausbreitung des Coronavirus kann sich nur halten , wer auch ein","Zuhause","hat ."
"595","2020-04-12","internetbasiert","Corona, die Demokratie und der Profit | KenFM.de. KenFM.de, 2020-04-12","https://kenfm.de/corona-die-demokratie-und-der-profit/","Wie viele sterben","Zuhause","und im Heim , auch an Lungenentzündung ."
"596","2020-04-12","internetbasiert","Corona, die Demokratie und der Profit | KenFM.de. KenFM.de, 2020-04-12","https://kenfm.de/corona-die-demokratie-und-der-profit/","Aber sperren wir deswegen alle gleich","Zuhause","ein um weitere Straftaten zu verhindern ?"
"597","2020-04-12","internetbasiert","Häusliche Gewalt ist kein Schicksal - sondern ein Problem, das alle angeht. Tagesspiegel, 2020-04-12","https://www.tagesspiegel.de/politik/corona-und-die-ausgehbeschraenkungen-haeusliche-gewalt-ist-kein-schicksal-sondern-ein-problem-das-alle-angeht/25718698.html","Das Adjektiv „ häuslich “ ist auf den ersten Blick schlicht ein beschreibendes , tendenziell gemütliches Wort , bezogen auf das Verhältnis der Menschen zum Haus , zum","Zuhause","."
"598","2020-04-11","internetbasiert","Abschalten durch Einschalten. Tagesspiegel, 2020-04-11","https://www.tagesspiegel.de/gesellschaft/medien/fernsehen-in-der-coronakrise-abschalten-durch-einschalten/25734744.html","Man ertappt sich : Lieber Füchse im Regierungsviertel als Frank Plasberg , Kater Jimmy in „ Tiere suchen ein","Zuhause","“ sticht eindeutig Tina Hassel und den „ Bericht aus Berlin “ aus ."
"599","2020-04-11","internetbasiert","Corona: Zahlen deuten auf Anstieg häuslicher Gewalt hin. tagesschau.de, 2020-04-11","https://www.tagesschau.de/ausland/corona-europarat-haeusliche-gewalt-pejcinovic-buric-101.html","Laut der Generalsekretärin des Europarats in Straßburg , Marija Pejcinovic Buric , zeigen Berichte aus den EU-Mitgliedsstaaten , dass Kinder und Frauen derzeit in ihrem","Zuhause","einem höheren Missbrauchsrisiko ausgesetzt sind als vor dem Ausbruch der Pandemie ."
"600","2020-04-11","internetbasiert","Covid-19, Home Office und häusliche Gewalt. Heise Online, 2020-04-11","https://www.heise.de/tp/features/Covid-19-Home-Office-und-haeusliche-Gewalt-4700463.html","In ihrem eigenen","Zuhause",""" , wird Guterres zitiert ."
"601","2020-04-11","internetbasiert","Die Corona-Pandemie verändert unser Leben vollkommen | The European. The European, 2020-04-11","https://www.theeuropean.de/frank-walter-steinmeier/die-corona-pandemie-veraendert-unser-leben-vollkommen/","Und : die Kinder , die Frauen , für die das eigene","Zuhause","leider kein Ort der Geborgenheit und Sicherheit ist – und die jetzt viel häufiger Opfer von häuslicher Gewalt zu werden drohen ."
"602","2020-04-11","internetbasiert","Strukturwandel: Wie der Coronavirus die Marktwirtschaft durchdringt - WELT. DIE WELT, 2020-04-11","https://www.welt.de/regionales/hamburg/article207187145/Strukturwandel-Wie-der-Coronavirus-die-Marktwirtschaft-durchdringt.html","Als Beispiel nennt Vöpel , Professor für Volkswirtschaftslehre an der HSBA Hamburg School of Business Administration , das betriebliche Arbeiten von","Zuhause","aus :"
"603","2020-04-11","internetbasiert","Corona, Cops & Quarantäne. Wann wird Befehlsverweigerung zur Pflicht? | KenFM.de. KenFM.de, 2020-04-11","https://kenfm.de/corona-cops-quarantaene-wann-wird-befehlsverweigerung-zur-pflicht/","Die Aufforderung","Zuhause","zu bleiben gibt es auch in Schweden ."
"604","2020-04-11","internetbasiert","Franzosen dürfen Corona-Regeln für Tier-Adoption brechen. N-Tv Nachrichten, 2020-04-11","https://www.n-tv.de/der_tag/Franzosen-duerfen-Corona-Regeln-fuer-Tier-Adoption-brechen-article21708763.html","Der Verein , der vor drei Wochen seine mehr als 60 Tierheime schließen musste , hatte am Montag die Regierung um eine Ausnahmegenehmigung gebeten , da in zahlreichen überfüllten Tierheimen Tausende Tiere auf ein neues","Zuhause","warteten ."
"605","2020-04-11","internetbasiert","So gab es die Tagesschau noch nie: Jan Hofer moderiert am Küchentisch und macht Eröffnungsmelodie selbst. Merkur.de, 2020-04-11","https://www.merkur.de/tv/tagesschau-homeoffice-jan-hofer-instagram-ard-coronavirus-moderation-tv-zr-13647854.html","Chefsprecher Jan Hofer moderiert von","Zuhause","aus ."
"606","2020-04-11","internetbasiert","Kenneth Edmonds nach Covid-19-Erkrankung fast genesen - WELT. DIE WELT, 2020-04-11","https://www.welt.de/newsticker/dpa_nt/infoline_nt/boulevard_nt/article207201729/Kenneth-Edmonds-nach-Covid-19-Erkrankung-fast-genesen.html","Auf Einladung der Rapper Swizz Beatz und Timbaland wolle er am 18. April von","Zuhause","bei einem Hip-Hop-Musikevent auf Instagram Live mitmachen ."
"607","2020-04-11","internetbasiert","Kenneth Edmonds nach Covid-19-Erkrankung fast genesen - WELT. DIE WELT, 2020-04-11","https://www.welt.de/newsticker/dpa_nt/infoline_nt/boulevard_nt/article207201729/Kenneth-Edmonds-nach-Covid-19-Erkrankung-fast-genesen.html","« Bleibt","Zuhause",", bleibt sicher » ."
"608","2020-04-11","internetbasiert","Basketball-Bundesliga: Die Skyliners wollen spielen. Frankfurter Allgemeine Zeitung, 2020-04-11","https://www.faz.net/1.6721511","Es ist von hohen Einschaltquoten auszugehen , weil die Menschen momentan an ihr","Zuhause","gebunden sind ."
"609","2020-04-11","internetbasiert","""Klopapierterror"" und Alexa als Schulglocke: SPIEGEL-Nutzer über den Corona-Alltag - DER SPIEGEL - Services. Derspiegel, 2020-04-11","https://www.spiegel.de/services/corona-alltag-spiegel-nutzer-berichten-a-efe2fec7-4035-49fb-8183-ab08e346749f","Außerdem liegen ein paar Sportgeräte bei mir","Zuhause","."
"610","2020-04-10","internetbasiert","„Ist das der endgültige Sieg der Jogginghose?“. Tagesspiegel, 2020-04-10","https://www.tagesspiegel.de/themen/mode/autorin-katja-eichinger-ueber-mode-und-corona-ist-das-der-endgueltige-sieg-der-jogginghose/25732722.html","Die Schubladen , in die wir uns aufgeteilt haben , Büro ,","Zuhause",", die fallen alle weg ."
"611","2020-04-10","internetbasiert","„Wir alle sind in einem riesigen psychologischen Experiment“. Tagesspiegel, 2020-04-10","https://www.tagesspiegel.de/politik/die-gesellschaft-kann-aus-der-pandemie-lernen-wir-alle-sind-in-einem-riesigen-psychologischen-experiment/25703778.html","Wir haben jetzt schnell gelernt , dass es hilft , auch im Homeoffice eine Tagesstruktur zu haben und auch","Zuhause","und mit der Familie zu unterscheiden zwischen Arbeit und Privatem ."
"612","2020-04-10","internetbasiert","Sterben der Alten in Italien: Niemand spricht Abschiedsworte. Frankfurter Allgemeine Zeitung, 2020-04-10","https://www.faz.net/1.6717555","„ Auf einmal sehe ich die Menschen , in deren Mitte der Sterbende lebte , ich sehe ihr","Zuhause",", höre ihre Stimmen , sehe ihre Gesichter , ihre Tränen , und sie sehen ihren Angehörigen und mich , die Ärztin , die nicht helfen kann . “"
"613","2020-04-10","internetbasiert","Isolation in der Coronakrise: Sperrt uns ein!. Tazgezwitscher, 2020-04-10","https://taz.de/!5675306/","Dass das ganze Dorf","Zuhause","bleibt , wäre aber Unsinn ."
"614","2020-04-10","internetbasiert","Isolation in der Coronakrise: Sperrt uns ein!. Tazgezwitscher, 2020-04-10","https://taz.de/!5675306/",""" Dass das ganze Dorf","Zuhause","bleibt , wäre aber Unsinn . """
"615","2020-04-10","internetbasiert","Isolation in der Coronakrise: Sperrt uns ein!. Tazgezwitscher, 2020-04-10","https://taz.de/!5675306/","Und da es ja , wie skizziert , nicht nur um ein bisschen materiellen Verzicht und ein bisschen freiwilliges","Zuhause","bleiben geht , sondern um existenzielle Gefahren , sind die Tendenzen klar ."
"616","2020-04-10","internetbasiert","Isolation in der Coronakrise: Sperrt uns ein!. Tazgezwitscher, 2020-04-10","https://taz.de/!5675306/","Dass das ganze Dorf","Zuhause","bleibt , wäre aber Unsinn ."
"617","2020-04-10","internetbasiert","Isolation in der Coronakrise: Sperrt uns ein!. Tazgezwitscher, 2020-04-10","https://taz.de/!5675306/",""" Dass das ganze Dorf","Zuhause","bleibt , wäre aber Unsinn . """
"618","2020-04-10","internetbasiert","Isolation in der Coronakrise: Sperrt uns ein!. Tazgezwitscher, 2020-04-10","https://taz.de/!5675306/","Und da es ja , wie skizziert , nicht nur um ein bisschen materiellen Verzicht und ein bisschen freiwilliges","Zuhause","bleiben geht , sondern um existenzielle Gefahren , sind die Tendenzen klar ."
